<?xml version="1.0" encoding="UTF-8"?>
<!DOCTYPE PlayerConfig SYSTEM "ieti_card_game.dtd">
<PlayerConfig>
	<playerLife>10</playerLife>
	<summonPointsPlayer>5</summonPointsPlayer>
	<deck>
		<card summonPoints="5" type="Caballeria">
			<name>Coloclan</name>
			<description>En su corazón, esta el amor.</description>
			<attack>2</attack>
			<defense>3</defense>
		</card>
		<card summonPoints="5" type="Lanceros">
			<name>Canirme</name>
			<description>En su corazón, esta el amor.</description>
			<attack>0</attack>
			<defense>5</defense>
		</card>
		<card summonPoints="3" type="Lanceros">
			<name>Curgo</name>
			<description>¡Por el poder del agua!</description>
			<attack>1</attack>
			<defense>2</defense>
		</card>
		<card summonPoints="4" type="Infanteria">
			<name>Calión</name>
			<description>En su corazón, esta el amor.</description>
			<attack>4</attack>
			<defense>0</defense>
		</card>
		<card summonPoints="2" type="Caballeria">
			<name>Bele</name>
			<description>En su corazón, esta el amor.</description>
			<attack>1</attack>
			<defense>1</defense>
		</card>
		<card summonPoints="5" type="Lanceros">
			<name>Histis</name>
			<description>¡Fuera de mi camino!</description>
			<attack>2</attack>
			<defense>3</defense>
		</card>
		<card summonPoints="5" type="Lanceros">
			<name>Marmenta</name>
			<description>¡Por la marea!</description>
			<attack>1</attack>
			<defense>4</defense>
		</card>
		<card summonPoints="2" type="Infanteria">
			<name>Conen</name>
			<description>Nadie es mejor que yo...</description>
			<attack>0</attack>
			<defense>2</defense>
		</card>
		<card summonPoints="5" type="Lanceros">
			<name>Voldole</name>
			<description>Nadie es mejor que yo...</description>
			<attack>1</attack>
			<defense>4</defense>
		</card>
		<card summonPoints="5" type="Caballeria">
			<name>Mille</name>
			<description>Indeseable bestia...</description>
			<attack>3</attack>
			<defense>3</defense>
		</card>
		<card summonPoints="5" type="Caballeria">
			<name>Perofora</name>
			<description>Indeseable bestia...</description>
			<attack>2</attack>
			<defense>5</defense>
		</card>
		<card summonPoints="5" type="Caballeria">
			<name>Estabie</name>
			<description>Indeseable bestia...</description>
			<attack>3</attack>
			<defense>3</defense>
		</card>
		<card summonPoints="5" type="Infanteria">
			<name>Numba</name>
			<description>Nadie es mejor que yo...</description>
			<attack>4</attack>
			<defense>4</defense>
		</card>
		<card summonPoints="4" type="Lanceros">
			<name>Desego</name>
			<description>En su corazón, esta el amor.</description>
			<attack>3</attack>
			<defense>1</defense>
		</card>
		<card summonPoints="1" type="Lanceros">
			<name>Descierta</name>
			<description>¡Fuera de mi camino!</description>
			<attack>1</attack>
			<defense>0</defense>
		</card>
		<card summonPoints="5" type="Caballeria">
			<name>Elerochan</name>
			<description>¡Por el poder del agua!</description>
			<attack>4</attack>
			<defense>1</defense>
		</card>
		<card summonPoints="3" type="Lanceros">
			<name>Recone</name>
			<description>¡Fuera de mi camino!</description>
			<attack>2</attack>
			<defense>1</defense>
		</card>
		<card summonPoints="4" type="Caballeria">
			<name>Esmador</name>
			<description>¡Por la marea!</description>
			<attack>2</attack>
			<defense>2</defense>
		</card>
		<card summonPoints="2" type="Infanteria">
			<name>Hembad</name>
			<description>¡Por el poder del agua!</description>
			<attack>0</attack>
			<defense>2</defense>
		</card>
		<card summonPoints="3" type="Caballeria">
			<name>Almen</name>
			<description>¡Fuera de mi camino!</description>
			<attack>0</attack>
			<defense>3</defense>
		</card>
	</deck>
</PlayerConfig>